{
  "schema_version": 1,
  "runtime_version": "0.1.0-child1",
  "repository_topology": "multi-repo",
  "control_repository": "acme/control",
  "implementation_repositories": ["acme/service-a", "acme/service-b"],
  "human": {
    "principals": [{ "actor_id": 123456, "login": "product-owner" }]
  },
  "semantic_authority_map": [
    { "fact_domain": "product-contract", "source_ref": "issue-body", "currentness": "current" }
  ],
  "required_checks": ["unit"],
  "role_runners": {
    "A": {
      "adapter_id": "github-workflow://acme/control/agenti-role-a.yml",
      "adapter_version": "1",
      "capability_profile": "A_READ_ANALYZE"
    },
    "D": {
      "adapter_id": "github-workflow://acme/service-a/agenti-role-d.yml",
      "adapter_version": "1",
      "capability_profile": "D_WORKSPACE_WRITE"
    },
    "R": {
      "adapter_id": "github-workflow://acme/service-b/agenti-role-r.yml",
      "adapter_version": "1",
      "capability_profile": "R_READ_REVIEW",
      "independence_mechanism": "fresh-wrapper"
    },
    "P": {
      "adapter_id": "github-workflow://acme/control/agenti-publish.yml",
      "adapter_version": "1",
      "capability_profile": "P_PUBLISH"
    }
  },
  "independent_r_enforcement": {
    "mechanisms": {
      "fresh-wrapper": {
        "attestation_source": "deterministic-wrapper",
        "fresh_execution_required": true,
        "trusted_platform_fields": ["run_id", "run_attempt"]
      }
    }
  },
  "identities": {
    "O": {
      "identity_id": "o-github-app",
      "capability_profile": "O_CONTROL_PLANE",
      "dispatch_mechanism": "workflow_dispatch",
      "permissions": {
        "metadata": "read",
        "contents": "read",
        "issues": "write",
        "pull_requests": "read",
        "checks": "read",
        "actions": "write",
        "deployments": "read"
      }
    },
    "P": {
      "identity_id": "p-publisher",
      "capability_profile": "P_PUBLISH",
      "dispatch_mechanism": "none",
      "permissions": {
        "metadata": "read",
        "contents": "write",
        "issues": "read",
        "pull_requests": "write",
        "checks": "read",
        "actions": "read",
        "deployments": "write"
      }
    }
  },
  "release_authorization": { "required": true, "target": "production" },
  "publication": { "boundary_operations": ["MERGE", "DEPLOY"] },
  "state_projection": { "marker": "agenti-state:v1", "single_writer": "O" }
}
